{"$schema":"https://json-schema.org/draft/2020-12/schema","title":"team_member","type":"object","required":["type","slug","name","role","email","category","bio_markdown","photo_path"],"properties":{"type":{"const":"team_member"},"slug":{"type":"string"},"name":{"type":"string"},"role":{"type":"string"},"email":{"type":"string"},"category":{"enum":["faculty","phd","masters","alumni"]},"importance":{"type":"integer"},"bio_markdown":{"type":"string"},"photo_path":{"type":"string"},"photo_source":{"type":"string"}},"additionalProperties":true}