{"type":"team_member","slug":"pilot-test-member","name":"Pilot Test Member","role":"Ph.D. Student (pilot)","email":"pilot@drexel.edu","category":"phd","importance":99,"bio_markdown":"This profile is a **pilot test** for the content agent workflow. Do not merge to main.","photo_path":"assets/img/team/ziyi-chen.jpeg"}